article,denial?
"We are told that Amazon fires are at record levels right now. This is a blatant lie. The only “record” is that Amazonian fires have DECREASED over the “record”.

This is what we are being told.

Fig 1: Screen Shot of Google Search (search term: Amazon Fires at Record)

This (is) what the data actually looks like, to August 22. Yes, its updated daily.

Fig 2: Amazon Fire Totals via MODIS (2019 is highlighted)

This comes from a wonderful site, https://www.globalfiredata.org/forecast.html#elbeni

It uses NASA MODIS data, from the Terra and Aqua satellites, and is updated daily. By going to the website, you can look at individual regions in the Amazon, or as I have done, look at the totals for the Amazon. This site also has global data, but I am only looking at the Amazon region here.

The Interactive Graphs are very informative. Hovering the cursor over the graph will show the data at that point.

You can highlight individual years, by clicking on a year in the legend at the bottom of the graph. That year remains bright, while the rest are dimmed. Using Eyeball Mark 1 Trend Indicator (EBM1TI), 2019 is slightly high, but not at record levels. Not even close.

One thing I saw by looking at each year, was a rough pattern – one or two bad years, one or two years at much lower levels, then a bad year. This pattern is there until 2010. 2010 was the last “bad year”. Levels since 2010 have been 1/2 or less of the “bad years”. The old pattern has been broken.

Not only does this site calculate number of fires, it also calculates carbon emissions (in Tg) from the fires. Note that the site issues a caveat about estimated later data, hence its grayed out.

This emissions chart from the website shows what I was talking about, in alternating bad/good years. But as I said, only until 2010. It is obvious there is a reducing trend in emissions, again using EBM1TI.

Again, by hovering the cursor over the bar chart, you can look at data points. Clicking on a legend at the bottom will highlight that series.

Is it significant? Dunno. I need to download and trend the data. I can say definitively, that there is no increasing trend, and 2019 is a LOONNGG way from record territory.

Fig 3: Annual Estimated Amazonian Emissions

Note that the Annual Emissions would have to incorporate fire area, to get the total emissions. Just in case anyone would object that fire numbers are not fire area.

Conclusion: Amazonian fires, using very current NASA data, show a decline over the record, and are nowhere close to a record so far in 2019.

Postscript 1: As Willis often says, if you disagree with something I said, quote exactly what I said, and why it is wrong.

Postscript 2: This might be a good Reference Page. Have a “Fires” page, with the MODIS charts embedded. Charles, Anthony?

Postscript 3: The NY Times claims 2019 fires are way up, over 2018. That is correct. What they don’t say, is that about 1/2 the years BEFORE 2019 are higher, and about 1/2 are lower. Cherry picking of the first order.

Postscript 4: Nick Stokes points out that one province is at record levels of fires. True, its just under record levels today. But that means that the rest of the entire region must be UNDER average (2003-present). Looking at each region in the Amazon Basin, that is indeed true. Santa Cruz and Amazonas are above average, the rest are at or well below average. Result? The entire region is very nearly at the MODIS average for this time of year.

Share this: Print

Email

Twitter

Facebook

Pinterest

LinkedIn

Reddit

",1
"LAST Wednesday, in a blaze of unremittingly fawning publicity and uncritical adulation of which even Moses descending from Mount Sinai with the tablets bearing the Ten Commandments would have been envious, the good ship Mazilia – or, as I prefer to call it in view of its almost quasi-religious mission, ‘Greta’s Ark’ – set sail from Plymouth bound for New York, carrying no less a personage, if you believe the Green hype, than putative Saviour of the World, diminutive, pigtailed ‘climate activist’ Greta Thunberg, aged 16.

There’s much about this stunt and its main protagonist to mock. But just for the purposes of this article, ignore for a moment both the grotesque cynicism of egregiously exploiting a clearly troubled and vulnerable child to advance an eco-totalitarian political agenda, and the incongruity that few of us can whistle up a $4million, 18-metre (60ft) yacht from Prince Albert of Monaco to cross the Atlantic to assuage our enviro-guilt, and consider just one question.

Precisely how green is the Blessed Greta’s planet-saving maritime odyssey?

Initially, let’s hopefully forestall any potential criticism for mixing up the terminology. Carbon dioxide (CO2) is an invisible, colourless, odourless 0.04 per cent trace gas essential to all plant life on Earth – though that, apparently, has not stopped Greta’s mother, a well-known Left-‘Liberal’ activist called Marlena Ernman, from saying her daughter can see it. Truly do the righteous have bestowed upon them gifts denied to the rest of us.

Carbon (C) on the other hand, is the predominant element in coal. Which is why the Green movement always uses the language of ‘carbon’-footprint or ‘carbon’-free, when they actually mean CO2. Because in the public mind, carbon is nasty black stuff, isn’t it, while wanting, on spurious scientific grounds, to reduce the Earth’s capacity for plant and crop growth perhaps isn’t a good look.

First, how did Greta get to Plymouth? On foot? By bike? On a magic carpet borne aloft by unicorns? Or perhaps, more prosaically, not by ‘carbon’-free means at all, but by using the same fossil-fuel powered transport that we’re enjoined to eschew on pain of eternal eco-damnation?

Next, Greta’s Ark required the assistance of other vessels to undock her and tow her out of Plymouth. Oddly, this was not accomplished by several longboats manned by brawny matelots lustily belting out a traditional sea-shanty, but by a couple of RIBs. They may have electric engines, but ‘carbon’-free their production ain’t.

Let’s look at the supposedly ‘zero-emissions’, ‘carbon’-free yacht itself. It’s built of carbon fibre. (Remember, we sceptics aren’t the ones who started the misuse of scientific terminology for political effect.) Now, the production process for building a carbon-fibre yacht is estimated to be around 14 times as energy-intensive, and thus in ‘carbon’, i.e. CO2, emissions, as that for building one of equivalent length in steel. Not only that. The epoxy resins used in the construction of Greta’s Ark are different and are all organic materials made from petroleum and significant amounts of natural gas.

Some intriguing revelations about the crewing arrangements emerged soon after departure. It turns out that the three westbound crossing crew will be flying back from New York to Europe, while the replacement crew of five will be flying from Europe to New York for the return passage.

Hilarious

Greta's boat trip to the US might emit 6x a flight, because the 5 people taking the boat back will fly over to NYC https://t.co/6tiHcEz7It — Bjorn Lomborg (@BjornLomborg) August 16, 2019

So that’s three transatlantic flights for Greta’s Ark westbound crew to return from New York, plus five more for its replacement eastbound crew to get to New York. I’m guessing those flights won’t be in Economy, either. What’s their ‘carbon’-footprint? Why can’t she just fly to New York with her father? Or even address the United Nations via Skype?

Even though this eco-boondoggle has its own website on which the yacht’s progress can be tracked, some of us prefer to access more independent sources of information. So it was some surprise to see that, last Friday, on the Marine Traffic website, it appeared that the yacht’s position had stopped being reported at 0132 BST on Thursday morning, a mere 9½ hours after leaving Plymouth, and still identifiably in the English Channel Western Approaches.

Which at the time struck me as slightly odd; as did the fact that, as far as I know – and I’ll happily stand corrected if wrong – there were no news broadcasts from the air filming the yacht at sea. Given the obsequious near-24/7 coverage pre-departure, I mused, wouldn’t one have expected at least Sky News and the BBC to have arranged that, when the yacht was still only about 1½ to 2 hours flying time at most from either Cornwall or Brittany?

Fast forward to Saturday, and a possible answer, with a picture transmitted from Greta’s Ark itself. Look closely at the right-hand image.

So yesterday Greta Thunberg shared her boat's position (first pic) and tweeted a photo (second pic). Given the position, what is that in the background? There have been unproven rumours of a powered chase boat. Any thoughts? Seems rather close. pic.twitter.com/sd2cGMy48W — Tony Roberts (@T_Roberts2019) August 17, 2019

What’s that in the top right-hand corner? Why, yes, it looks for all the world like a chase boat. Is this the way she’s being ‘accompanied by her father Svante Thunberg and filmmaker Nathan Grossman’? If so, that looks distinctly fossil-fuel powered.

Add all these up – the construction, the crew flights, the possibility, though denied, of a chase boat – and suddenly this venture doesn’t look anything like as green as it’s made out to be. But in this inversion of the fable of The Emperor’s New Clothes, we aren’t allowed to say so.

This entire eco-stunt, the sacerdotal reverence with which it’s being treated, and the invective heaped on those who dare challenge it, is in many ways an ideal metaphor for how deep-Green ideology has now acquired all the characteristics of a religious cult.

Like other pre-Enlightenment belief systems, it posits a prelapsarian state of grace, a pristine, innocent, nature-harmonious Rousseau-ean past which has been corrupted by modernity, industrialisation and capitalism, notwithstanding their having wrought in just 250 years an improvement in the human condition unprecedented in previous millennia.

It holds that the restoration of environmental equilibrium, the reversal of Man’s Fall from the Garden of Eden, requires above all sacrifice and submission to an elite, who will dispense indulgences – aka ‘carbon’-credits – while intolerantly silencing and excommunicating the heretics.

If the contradictions behind the Odyssey of the Greta’s Ark help more people to see that more clearly, then it may yet prove beneficial. Though mercifully not in the way it intends.

If you appreciated this article, perhaps you might consider making a donation to The Conservative Woman. Our contributors and editors are unpaid but there are inevitable costs associated with running a website. We receive no independent funding and depend on our readers to help us, either with regular or one-off payments. You can donate here. Thank you.",1
"https://finance.yahoo.com/video/democratic-party-concerned-climate-change-164111099.html

Broadcast August 23, 2019 – Varney & Co. – Fox Business – Watch here:





Rush Transcript:

Right now we are down 93. A few minutes ago we were down 140.

>> The g7 meeting starts tomorrow and France’s president macron wants world leaders to put the fires in the amazon rain forest at the top of the agenda. We have seen a lot of coverage of this recently. Those fires are ongoing. Joining us, climate depot founder. The fires are getting political. I see a clash coming at the g7 between especially the europeans who are dead set against climate change and President Trump. There’s Politics coming up here.

>> There is. The first thing you got to understand, they are punishing Brazil’s leadership for threatening to pull out of the u.n. Paris agreement, for not accepting the scientific consensus, and they have actually distorted the fires here. NASA just came out and said historically, the fires in the amazon are not unprecedented, they are only up a huge amount from last year but they are historically low and only the biggest since 2013. Brazil is being punished because of these fires because of their stance on climate change. President Trump, the same way they punished President Trump. He’s going to this meeting and he’s been vilified for years for the same exact issue. Of course, trump doesn’t help himself by, you know, his demeanor with some of the world leaders. But in the case, you know, in the case of Brazil and trump, they will sort of be on the outs at this g7 summit by all the other leaders, particularly macron. Stuart: guaranteed. Now, I’m sure you saw it. Bernie Sanders submits his green plan, his climate change plan. $16 trillion worth of cost right there. Then we heard that the democrat national committee is not going to have a single issue debate. They were going to have a single debate on climate change. Now they’re not going to do it. Seems to me that the party, the democrats, don’t want an intense discussion of climate change because the country’s not behind it. What say you?

>> Absolutely, yeah. The climate candidate, governor inslee, just dropped out. He was at .2% at the latest Iowa poll. The day after he drops out, the dnc not only do they not have a debate, but biden’s campaign is quoted as saying a climate debate specifically focused on that is quote, dangerous territory for the democrats. This goes on the heels of even MSNBC saying that climate is a ratings killer, whenever they cover the issue. So the democrats are terrified of being seen as the climate-only party and bernie is just stepping up to the plate and trying to out aoc, aoc on the green New Deal, coming up with an even more expensive and ambitious plan. Stuart: is it $16 trillion? That was for bernie’s plan.

>> $16.3 trillion or something. Yes. Stuart: over a ten-year period, I think.

>> Yes. He also has magical thinking. 3% of our energy comes from solar and wind. By 2030 he wants it to be 100% of our electricity. This is fantasy thinking. He also wants to punish fossil fuel companies, start prosecuting them for the damage they have caused allegedly. He also is going to give $200 billion to the u.n. Green climate fund. This is a wish list of all the climate activists and political left and it’s really designed just to pressure the Democratic Party and particularly Joe Biden to kow-tow to the Democratic Party climate interests. Stuart: I think it’s a bad political strategy. Even the activists in the party who run the primaries, I don’t see them going for a $16 trillion climate plan and $31 trillion Medicare for all plan. I just don’t see that. I think they have gone so far out of line with the rest of the party that I don’t think they are going to win on this one.

>> No. And I think it’s pretty transparent. There’s a whole bunch of non-climate stuff in bernie’s plan, as there was aoc. This has nothing to do with the climate. This is using the climate scare to get this radical agenda across. I think it’s even scaring the quote from the biden campaign, not only was it dangerous territory but it’s dangerous territory for middle America, for expanding the Democratic Party base, and the mainstream democrats, the establishment, they are terrified of bernie. They are terrified of this issue and the way the hardcore activists want to exploit this into a wholesale change of the american economy which by the way, would have no impact on the climate even if they are right on the science which they’re not, using the epa’s own model. There would be no impact on temperatures 100 years from now

Related Links:

Amazon rainforest fires at record high levels? ‘This is a blatant lie’ – Fires ‘nowhere close to a record so far in 2019’

NASA: Amazon Is Burning At ‘Below Average’ Rates

Climate Depot Report: Rainforest Factsheet: Clear-Cutting the Myths About the Amazon and Tropical Rainforests

Also, the Amazon is not the ""lungs of the Earth"" as stated over and over. ""The Amazon does produce an enormous amount of oxygen, but it consumes as much as it produces."" More from my film on Amazon rainforest here: https://t.co/aDMDCgqV59 — Marc Morano (@ClimateDepot) August 23, 2019

Also, the Amazon is not the ""lungs of the Earth"" as stated over and over. ""The Amazon does produce an enormous amount of oxygen, but it consumes as much as it produces."" More from my film on Amazon rainforest here: https://t.co/aDMDCgqV59 — Marc Morano (@ClimateDepot) August 23, 2019

Trump heading to G-7 summit after insulting allied world leaders

Brazil’s Bolsonaro accuses French president of ‘colonialist mindset’ after calls for action on Amazon fires

Amazon fires: how celebrities are spreading disinformation

Global worry over Amazon fires escalates; Bolsonaro defiant

‘Practice What You Preach’: Student Asks Bernie Sanders About His Own Fossil Fuel Use – Sanders declares: ‘I’m not going to walk to California’

Bernie Sanders Unveils Massive $16 Trillion Green New Deal Plan ‘to defeat the existential threat of climate change’

Watch: Morano on Fox & Friends – Bernie & The (Private) Jets – Sanders wants fossil fuels kept in the ground, but ‘he can’t keep from using fossil fuels lavishly — in the air!’

A panel of the Democratic National Committee on Thursday rejected a proposal to host a single-issue debate on the climate crisis. – Excerpt: Inslee had no impact on front runner Biden: Symone Sanders, a senior adviser of presidential candidate Joe Biden, was among those who urged the DNC on Thursday to vote down a climate debate, saying it would be “dangerous territory in the middle of a Democratic primary process.” That contrasts with what Biden had earlier said during a campaign stop in Iowa this summer. The former vice president had endorsed having a climate debate, telling Greenpeace, “I’m all in.”

Even EPA Climate Models Show The ‘Green New Deal’ Would Have No Detectable Impact On Global Temps

GREEN REVOLUTION? SOLAR & WIND PRODUCED JUST 3% OF GLOBAL ENERGY – Wind and solar energy generation is growing, but it’s still an incredibly small part of the global energy mix, according to statistics compiled by the oil giant BP. Meanwhile, fossil fuels — coal, natural gas and oil — accounted for 85% of global energy consumption in 2018, BP reported Tuesday as part of its annual energy report. In fact, BP reported the U.S. led the world in oil and natural gas production growth. U.S. petroleum output saw the biggest annual growth ever recorded in any country, BP said. In other words, shale is booming. The U.S. surpassed Saudi Arabia and Russia in 2018 to become the world’s largest oil-producing nation. “Oil remains the most used fuel in the energy mix,” BP reported in its annual energy review. “Coal is the second largest fuel but lost share in 2018 to account for 27%, its lowest level in 15 years. The share of natural gas increased to 24%, such that the gap between coal and gas has narrowed to three percentage points.”

EIA data 2018: Wind & solar met 3% of U.S. energy after $50 billion in subsidies – Fossil Fuels 81%– The EIA (U.S. Energy Info Admin) AEO 2019 report shows that in year 2018 wind and solar energy resources provide about 3% of U.S. total energy consumption while fossil fuel energy resources provide about 81% of total energy use.PTC (Production Tax Credit) subsidies for renewable solar and wind projects in the U.S. have now reached about $50 billion dollars in cumulative payments through year 2018 with these resources providing about 3% of our countries total energy consumption in that year…Additionally these annual wind and solar subsidiies now total more than $8 billion dollars per year.",1
"Morano: ""Bernie doesn’t want to be outdone by an upstart like AOC. He is coming out with his more aggressive, more expensive, more sweeping plan. So now the burden is back on AOC is she going to come back and compete with Bernie here"" I don’t know, Bernie is now the king of the Green New Deals.""

https://news.yahoo.com/bernies-16t-climate-plan-zero-105129474.html

Watch here:

Broadcast August 23, 2019 – Fox News Channel – Fox & Friends





Sen. Sanders: Climate change is not a hoax because very serious reality for the planet…Climate change is real and it is causes deficit stating problems in our country and all over the world…We need bold and aggressive action to combat climate change.

Steve Doocy: There you’ve got Bernie Sanders yesterday unveiling his plan for a Green New Deal. The newest green New Deal. Promising to combat climate change to the tune of over $16 trillion. Here to break down the details Marc Morano, Publisher of Climate Depot and author of the Politically Incorrect Guide to Climate Change. Good morning to you.

Marc Morano: >> Good morning, Steve. Happy to be here.

Steve Doocy: if all this stuff that Bernie wants, went into effect, how would it affect the climate?

Marc Morano: “If you go out fifth to 100 years, using the EPA’s climate models and assuming they are correct on the science. If you assume Al Gore is correct you would not be able to measure a temperature difference in 100 years based on the UN climate deal, the Paris agreement. It’s pure climate symbolism. Their own science supports that this is not about the science or climate change.

Steve Doocy: okay. So, let’s talk a little bit about what’s in it. He wants 100 percent renewable energy. Cut domestic emissions by 71%. Create 526 billion-dollar electric grid. On the big screen right now, if we could go back one, let’s look at how they would pay for it. 6.4 trillion from the sale of clean energy. 1.2 trillion from military cuts. 3.1 trillion in fossil fuel litigation. So they are going to sue the oil companies and 2.3 trillion raised from taxes on new Jobs. What do you think of that?

Marc Morano: It’s a massive restructuring. Interesting thing is suing the fossil fuel companies. First of all, fossil fuels provide more than 80% of the U.S. Energy, global energy. Solar and wind that he wants to by 2030 have 100 percent essentially renewables powering our economy — are 3% according to the U.S. Information Agency. He is going to turn 3% (solar and wind), somehow to into 100 percent magically at the same time go after fossil fuels which means prices are going to go up for everyone, hey, guess what? Energy price goes up. Bernie has the solution. He will have the government subsidize people who can’t pay so he is going to control it on one hand an subsidize it. It’s the perfect central planner’s dream. Perfect control over the energy economy with this plan.

Steve Doocy: He already endorsed AOC’s green New Deal. What’s the difference?

Marc Morano: The difference is this is even more ambitious. Bernie doesn’t want to be outdone by an upstart like AOC. He is coming out with his more aggressive, more expensive, more sweeping plan. So now the burden is back on AOC is she going to come back and compete with Bernie here” I don’t know, Bernie is now the king of the Green New Deals.

Related Links:

Bernie Sanders Unveils Massive $16 Trillion Green New Deal Plan ‘to defeat the existential threat of climate change’

‘Practice What You Preach’: Student Asks Bernie Sanders About His Own Fossil Fuel Use – Sanders declares: ‘I’m not going to walk to California’

Watch: Morano on Fox & Friends – Bernie & The (Private) Jets – Sanders wants fossil fuels kept in the ground, but ‘he can’t keep from using fossil fuels lavishly — in the air!’

Even EPA Climate Models Show The ‘Green New Deal’ Would Have No Detectable Impact On Global Temps

GREEN REVOLUTION? SOLAR & WIND PRODUCED JUST 3% OF GLOBAL ENERGY – Wind and solar energy generation is growing, but it’s still an incredibly small part of the global energy mix, according to statistics compiled by the oil giant BP. Meanwhile, fossil fuels — coal, natural gas and oil — accounted for 85% of global energy consumption in 2018, BP reported Tuesday as part of its annual energy report. In fact, BP reported the U.S. led the world in oil and natural gas production growth. U.S. petroleum output saw the biggest annual growth ever recorded in any country, BP said. In other words, shale is booming. The U.S. surpassed Saudi Arabia and Russia in 2018 to become the world’s largest oil-producing nation. “Oil remains the most used fuel in the energy mix,” BP reported in its annual energy review. “Coal is the second largest fuel but lost share in 2018 to account for 27%, its lowest level in 15 years. The share of natural gas increased to 24%, such that the gap between coal and gas has narrowed to three percentage points.”

EIA data 2018: Wind & solar met 3% of U.S. energy after $50 billion in subsidies – Fossil Fuels 81% – The EIA (U.S. Energy Info Admin) AEO 2019 report shows that in year 2018 wind and solar energy resources provide about 3% of U.S. total energy consumption while fossil fuel energy resources provide about 81% of total energy use.PTC (Production Tax Credit) subsidies for renewable solar and wind projects in the U.S. have now reached about $50 billion dollars in cumulative payments through year 2018 with these resources providing about 3% of our countries total energy consumption in that year…Additionally these annual wind and solar subsidiies now total more than $8 billion dollars per year.",1
