article,denial?
"Make fun of Al Gore? YouTube will slap a 'Fact Check' on you without your permission.

Michael Loftus admits he’ll grab any excuse to share his Al Gore impression.

Why not? It’s rock solid. Only this time the Big Tech Overlords were listening, too. And, apparently, they weren’t pleased that Loftus poked fun at the “Inconvenient Sequel” star.

The most recent Loftus Party video mocks both the former Vice President as well as President Barack Obama. The latter brought it on himself, to be fair.

The Obamas just bought a $15 million property on Martha’s Vineyard, AKA land kissing the Atlantic Ocean. The move drew plenty of criticism from conservatives, but not for any one-percent complaints.

Why would someone who believes global warming is causing the oceans to rise gobble up coastal property?

It’s a legitimate question, one most journalists refuse to ask. Not Loftus. The conservative comic joined the fray, using comedy to pile on the former President.

RELATED: 9 Films Obsessed with Climate Change

Enter YouTube.

The increasingly liberal channel stepped in, adding its own editorial slant to the video. The comedy clip now features a horizontal addendum below the frame. The text, credited to Wikipedia, describes Global Warming in a clinical fashion.

Is this a new feature at YouTube? Does the platform fact check liberal comedians, too? What about hard news clips exploring the now-debunked Russia collusion hoax? Do they get a horizontal explainer ribbon as well?

Loftus shared the YouTube situation on his latest podcast episode.

“At first, I was’t outraged by it … because they haven’t demonetized the video,” Loftus said. His anger grew the more he drilled into the matter.

“They are playing hardball … I can’t get rid of it,” he says of the info strip.

“They’re trying to do a little Kung Fu on me. ‘You wanna joke about Global Warming? We’re gonna embed a link onto your video with a banner talking about. It’s real, its non disputable, and here’s the link to Wikipedia.’ ”

“Wikipedia?”

RELATED: Damon’s ‘Downsizing’ Fears Climate Change

While Wikipedia feeds answers to voice-activated services like Siri and Alexa, journalists rarely rely on it a reputable news source.

This Loftus kerfuffle isn’t an isolated incident. Conservative pundit and Fox News contributor Dan Bongino says his YouTube videos are routinely demonetized shortly after being posted, but YouTube reverses that call the following day.

That matters since the first day a video tied to a news-related show launches is often its most trafficked window.

PragerU is squaring off against YouTube to court, again, for its consistent attacks on its wildly popular channel. The service lost the first round of the legal fight earlier this year.

Conservative comic Steven Crowder also tangled with the video service, getting demonetized in the process for his squabble with a gay journalist.

It’s part of a larger issue where Big Tech clamps down on conservatives while giving many liberals a pass. Far-left actor Ron Perlman recently found himself briefly suspended by Twitter for wishing death on the surviving Koch brother, Charles, hours after David Koch passed.

Yesterday Twitter slapped me with a 12-hour ban for a tweet referencing the Koch brothers. The day that we are silenced for calling out fascism, for pointing a finger at those who would rape and pillage the very air we breathe, may God help us! @twitter https://t.co/bkc9jwkRgD — Ron Perlman (@perlmutations) August 25, 2019

That’s the exception that proves the rule. The vast majority of Leftists remain free to Tweet what they wish, including Antifa accounts. Just ask Ellen Barkin.",1
"WaPo Key Excerpts: “I cannot remember any other big fire episode like this one,” said Vitor Gomes, an environmental scientist at the Federal University of Para. ... Ricardo Mello, head of the World Wide Fund for Nature’s Amazon program, struggled to find the words to describe his pessimism on Thursday. “It’s historically — this is highest number [of fires] I’ve ever seen,” he said. Climate Depot Note: You don't have to ""have seen or ""remember"" past fires based on one or two peoples limited memory and exposure. We have actual scientific data to show us what is happening and the data does not support these false ""memories"" that the Post cites twice in their feature article. # Brazil’s Bolsonaro gets blamed for same Amazon fires also plaguing socialist Bolivia – But Media Ignores!

The Washington Post is relying on an old tried and true reporting trick to obscure scientific reality. Instead of showing the actual scientific data that reveals their entire story narrative is fraudulent, the paper’s report Terrence McCoy, resorts to featuring two quotes in his front-page article of his cited “experts” using personal anecdotal recollection of how big the fires are.

WaPo Key Excerpts: “I cannot remember any other big fire episode like this one,” said Vitor Gomes, an environmental scientist at the Federal University of Para.

…

Ricardo Mello, head of the World Wide Fund for Nature’s Amazon program, struggled to find the words to describe his pessimism on Thursday.

“It’s historically — this is highest number [of fires] I’ve ever seen,” he said.

Climate Depot Note: You don’t have to “have seen or “remember” past fires based on one or two peoples limited memory and exposure. We have actual scientific data to show us what is happening and the data does not support these false “memories” that the Post cites twice in their feature article.

NASA’s caption: “As of August 16, 2019, satellite observations indicated that total fire activity in the Amazon basin was slightly below average in comparison to the past 15 years. Though activity has been above average in Amazonas and to a lesser extent in Rondônia, it has been below average in Mato Grosso and Pará, according to the Global Fire Emissions Database”

NYT tamps down hysteria: ‘Much of the land that is burning was not old-growth rain forest, but land that had already been cleared of trees and set for agricultural use’

Amazon rainforest fires at record high levels? ‘This is a blatant lie’ – Fires ‘nowhere close to a record so far in 2019’ “2019 fires are way up, over 2018. That is correct. What they don’t say, is that about 1/2 the years BEFORE 2019 are higher, and about 1/2 are lower. Cherry picking of the first order.”

…

The article goes on to reveal why the Washington Post and other mainstream media outlets are so willing to distort science and bash Brazil.

WaPo excerpt: “Brazil’s climate change denial is isolating the country,” said Mauricio Santoro, a professor of international relations at Rio de Janeiro’s state university. “It is a theme of the global agenda, and Brazil plays a central role, whether it wants to or not, because of the Amazon, because of its biodiversity.” And because of what’s happening now.

#

Related:

Watch: Morano on Fox with Varney: You have been Amazon.CONNED about rainforest fires & the Democratic Party is ducking climate debates & Inslee fails",1
"One day after reporting, “These fires were not caused by climate change,” The New York Times blamed the ongoing Amazon rain forest fires on....climate change.

In Sunday’s Times, Johannesburg bureau chief Norimitsu Onishi falsely conflated the Amazon rain forest fires in Brazil with global warming in “Europe Tries to Fill Void On Climate Left by U.S.,” a two-for-one story that blamed both President Trump and Brazil's ""far right"" president Jair Bolsonaro for failing to act on ""climate change."" A photo showing burning forest had a caption that underlined the purported connection: “Europe ‘has to be a green superpower,’ a member of Parliament said, as the Amazon burned.”

Onishi either fell victim to a lazy leftist assumption that the wildfires in the Amazonian rain forest were somehow connected to global warming, or else did his best to force the connection himself (click ""expand""):

As the Amazon burned and the world faced an ecological disaster, President Emmanuel Macron of France bluntly criticized Brazil’s leader this week and threatened to kill a major trade deal between Europe and Brazil. President Trump, on the other hand, posted a tweet only Friday evening, saying that the United States was ready to help contain the fires, but adding that “future trade prospects” between the United States and Brazil “are very exciting.” The contrast highlighted the gap in leadership on issues affecting the global climate. As the Trump administration denies established climate science and has abandoned an international accord intended to fight global warming, European leaders have energetically stepped in to take up the mantle of leadership.

Onishi made sure to get some hostile labeling in:

By week’s end, the global condemnation led by Mr. Macron appeared to have chastened President Jair Bolsonaro of Brazil, a far-right populist and climate change skeptic. (....) But given Mr. Trump’s position on climate, and the absence of China as well as Russia, the talks are not likely to lead to significant change, said Jean Jouzel, a leading French climate expert.

Theirs is only one problem with talking about the rain forest blazes and climate policy: These fires were not caused by climate change. We know that from an unimpeachable source, the New York Times, in an explainer story on Saturday by Alexandria Symonds, which helpfully states:

These fires were not caused by climate change. They were, by and large, set by humans. However, climate change can make fires worse. Fires can burn hotter and spread more quickly under warmer and drier conditions.

Still, Onishi barged forward, using the manmade (!) fires in Brazil to blame Trump and Brazil’s leader Bolsonaro for ignoring global warming:

“The international scene now lacks dynamism in the fight against global warming,” said Mr. Jouzel, who was vice chairman of the Intergovernmental Panel on Climate Change in 2007 when it won the Nobel Prize. “To effectively combat global warming, all countries must look in the same direction.”

This isn’t the first time Onishi has wrongly placed blame. In 2006, he wrote that ""Reaganesque policies of deregulation, privatization, spending cuts and tax breaks for the rich” were blame for inequality....in Japan.",1
"Greta Thunberg doesn’t go to school, because adults around her have convinced her the climate situation is simply too bad. Instead she is traveling on an expensive yacht to the US, preaching imminent doom as a “magnet for hope.” She has been told that children had a much brighter future when CO2 levels were lower, like a century ago. Greta believes greenhouse gases cause catastrophic heatwaves, natural disasters and disease, which will ruin her future..

It is easy enough to test that idea out, by looking at how children lived a century ago – at lower CO2 levels. On this date in 1916, children were out of school for different reasons. New York Public Schools were shut down due to a polio epidemic.

TimesMachine: Tuesday August 22, 1916 – NYTimes.com

Before the Vaccines: Medical Treatments of Acute Paralysis in the 1916 New York Epidemic of Poliomyelitis

The polio epidemic spread all over the country. This 1916 photo was taken in Billings, Montana. (At least the children didn’t have to face an extra 0.0001 mole fraction CO2 in the atmosphere.)

And what about the weather? On this date in 1916, there were 100 degree temperatures from Oregon to upstate New York. Adrian, Michigan was the hottest place in the country at 106 degrees.

States over 100F on August 22, 1916 : Michigan 106, Oklahoma 105, Arizona 104, Kansas 102, Louisiana 102, Ohio 102, Texas 102, New York 101, Utah 101, Missouri 100, New Jersey 100, Oregon 100 and Pennsylvania 100.

Ithaca NY was 101 degrees on this date in 1916. They have had a total of ten days over 100 degrees since 1895, all of which occurred more than 80 years ago.

All days over 100F at Ithaca, New York 7/3/1911 101 7/4/1911 102 7/5/1911 100 8/22/1916 101 7/2/1931 102 9/12/1931 100 6/29/1933 102 7/8/1936 101 7/9/1936 103 7/10/1936 102

The hottest August 22 across the US occurred in 1936. The average afternoon temperature across the US that day was 91 degrees.

Four states were over 110 degrees and twenty-one states were over 100 degrees on this date in 1936 : Missouri 112, South Dakota 112, Indiana 111, Arizona 110, California 109, Texas 108, Illinois 107, Oklahoma 107, Arkansas 106, Kansas 106, Kentucky 105, Michigan 105, Tennessee 105, Ohio 104, Iowa 103, Louisiana 103, Mississippi 102, Nebraska 102, West Virginia 102, Colorado 100 and Utah 100.

The second August 22 hottest occurred in 1938.

US August 22 afternoon temperatures have been declining since 1895.

The likelihood and areal coverage of hot weather has also been declining, with recent years among the coolest on record.

Two years after the polio outbreak of 1916, the deadliest pandemic in history killed as many as 40 million people, most of them young.

17 Oct 1918, Page 8 – Santa Ana Register at Newspapers.com

TimesMachine: August 21, 1998 – NYTimes.com

Greta is scheduled to speak at the UN when her yacht arrives, as their official science expert. In this role she replaces another high school dropout with a 450 foot long yacht.

To his credit, Leo DiCaprio always brings lots of climate models on the yacht with him.

Nothing Greta has been taught has any basis in reality. The Greta situation is a good reminder of how evil the people behind this scam are.",1
"https://twitter.com/clim8resistance/status/1164825275831480320

https://news.sky.com/story/rising-temperatures-will-make-hajj-pilgrimages-to-mecca-dangerous-says-study-11791357?utm_source=po.st&utm_medium=referral

British Muslims are being urged to take the lead on fighting climate change as a study suggests rising temperatures will make pilgrimages to Mecca dangerous.

The Hajj, one of the five pillars of Muslim faith, takes place in and around the city situated in a desert valley in western Saudi Arabia.

All Muslims are expected to take part at least once in their lifetime, if their health and finances allow.

Image: The pilgrimage lasts for five or six days

The timings of the annual religious event shift each year because it is based on the lunar calendar, and it involves spending around 20 to 30 hours outdoors over a period of around five or six days.

The Saudis want to increase the number of pilgrims to 10 million by 2030.

Researchers at the Massachusetts Institute of Technology in California say rising global temperatures could push up heat and humidity in the region in the hottest summer months to the extent that people face “extreme danger” to their health.

The Hajj is done – but challenges lie ahead for its future A vast army of workers have begun the task of clearing the detritus left on the roads ready for next year.

Elfatih Eltahir, the civil and environmental engineer who led the research, said: “When the Hajj happens in summer, you can imagine, with climate change and increasing heat-stress levels, conditions could be unfavourable for outdoor activity.",1
"BERLIN (Project Syndicate) — According to the latest report by the Intergovernmental Panel on Climate Change, the world’s main scientific authority on global warming, keeping global temperatures from rising more than 1.5°C above pre-industrial levels is a feasible goal. The IPCC's stance represents a move in the direction of the kind of “radical realism” that many civil-society actors have long advocated.

The IPCC does not bet on geo-engineering proposals — for example, deep-ocean sequestration of massive amounts of atmospheric carbon dioxide, or “dimming the sun” by spraying the atmosphere with aerosols — to combat global warming. These largely theoretical solutions could have untold consequences for people and ecosystems, worsening not only the climate crisis, but also the other social and ecological crises we face.

Instead, the IPCC focuses on how we can avoid crossing the 1.5°C threshold in the first place. We must, it asserts, decarbonize the global economy immediately to ensure that global CO2 emissions decline by about 45% by 2030 and reach net zero by 2050.

Limiting global temperatures to 1.5°C above pre-industrial levels is the only way to achieve social justice while protecting our environment from devastating climate change. And, contrary to prevailing wisdom, it’s not an impossible goal.

Achieving this will require not just transforming economic activity, but also confronting destructive power dynamics and social inequalities. “Radical Realism for Climate Justice,” a new anthology published by the Heinrich Böll Foundation, sets out strategies developed by international civil-society and social movements to bring about such change.

In line with the IPCC's core message, we urgently need a politically managed decline in fossil-fuel production. This means putting a brake on oil, coal, and gas production and exploration. As the group Oil Change International notes, it does not mean abrupt or panicked action that could lead to a “sudden and dramatic shut-down of fossil fuel production, stranding assets, damaging economies, and harming workers and communities reliant on the energy sector.”

In building up the renewable-energy sector, we should avoid replicating systems that have driven inequality and entrenched damaging power dynamics in the fossil-fuel sector and other industries. This means replacing the market-based, investor-focused approach to energy production with one that treats energy as a public good, while engineering a shift toward social ownership and management of energy supplies.

Rooted in energy sovereignty and self-determination, this approach would spur faster decarbonization, including by weakening vested interests’ power to resist change. It would also facilitate the restructuring of energy systems to serve social and ecological needs.

Another system-level transformation that would facilitate major emissions reductions would be the creation of a zero-waste circular economy, whereby everything we produce and consume returns safely to nature or is recycled and reused.

Consider textiles production, which in 2015 generated greenhouse-gas emissions totaling 1.2 billion tons of CO2-equivalents. These massive emissions — more than the combined total for all international flights and maritime shipping — reflect a “fast fashion” culture that produces garments as cheaply as possible, with the expectation of constant turnover in people’s wardrobes. If each garment were replaced half as often, the industry’s total greenhouse-gas emissions would plummet by 44%.

A zero-waste circular economy for textiles would include not just more use of the clothes that are produced, but also improved recycling and repurposing of materials, to avoid emissions-producing waste-disposal processes like incineration. The biggest gains would come from the introduction of less wasteful production processes.

Important steps should also be taken regarding land use (encompassing agriculture and zoning changes). As the international peasant’s movement La Via Campesina shows, the industrial food system’s emissions — including those from production, fertilizers, transport, processing, packaging, cooling, and food waste, and from deforestation associated with the expansion of industrial agriculture — account for 44% to 57% of the global total.

A peasant agro-ecological production system based on food sovereignty, small-scale farming, and agro-ecology could, La Via Campesina argues, halve carbon emissions from agriculture within a few decades. This approach is proven to work: small-scale farmers, peasants, fishers, indigenous communities, rural workers, women, and youth already feed 70% of the world’s population, while using only 25% of its agricultural resources.

There is also a need to restore natural ecosystems that have been destroyed.

Forests and peatlands, in particular, can sequester several hundred gigatons of CO2 from the atmosphere. Their restoration would protect not just biodiversity, but also local people, including the indigenous communities whose land-tenure rights have been systematically violated. In fact, retaining and expanding the land area under management by indigenous peoples and local communities could protect over 1,000 GtCO2 worth of carbon stocks.

According to a report by the Climate, Land, Ambition, and Rights Alliance, ecosystem-based approaches in the land sector and agro-ecological changes to food production and consumption systems — including more local ownership — could deliver 13 GtCO2eq per year in avoided emissions, and almost 10 GtCO2eq annually in sequestered carbon by 2050. The result would be 448 GtCO2 in cumulative removals by 2100 — around 10 times current global annual emissions.

Limiting global temperatures to 1.5°C above pre-industrial levels is our best hope of containing the effects of a climate crisis born of historical injustices and deep-rooted inequities.

The only way to succeed will be to undertake a shift to a new socioeconomic system. This means abandoning the single-minded obsession with gross domestic product growth — which has facilitated the proliferation of wasteful production and consumption patterns and fueled economic and social inequality and injustice — in favor of a public-goods approach that serves genuinely to make people’s lives better.

Demanding such a transformation is not “naive” or “politically unfeasible.” It is radically realistic. In fact, it is the only way we can achieve social justice while protecting our environment from devastating climate change.

This article was published with permission of Project Syndicate — A Radically Realistic Climate Vision.",1
