article,denial?
"All this week, the mainstream media have been trying to scare you with heartrending tales of burning Amazonia — a conflagration the like of which we have never seen before. Supposedly…

A Washington Post story headlined ‘Bolsonaro, Trump, and the nationalists ignoring climate disaster’ quotes Vitor Gomes, an environmental scientist at the Federal University of Para:

“I cannot remember any other big fire episode like this one.”

According to the BBC:

Brazil’s Amazon rainforest has seen a record number of fires this year, new space agency data suggests. The National Institute for Space Research (Inpe) said its satellite data showed an 84% increase on the same period in 2018.

According to NPR:

Half the fires in Brazil so far this year, nearly 36,000 of them, have ignited in just the past month. That’s nearly as many as in all of 2018.https://t.co/bphNHVcqcX — NPR (@NPR) August 22, 2019

According to this recidivist enviro-loon activist:

From a scientist who specializes in prehistorical fire in the Amazon: The current fires are without precedent in the past 20,000 years. These fires are not natural, they are being driven by greed, colonialism, and are a crime against humanity. We are in a climate emergency. https://t.co/ooGHlqb9Ua — Eric Holthaus (@EricHolthaus) August 22, 2019

The fires have spawned a hashtag — #PrayforAmazonia — and attracted the inevitable display of competitive virtue-signalling from the wankerati, with Jennifer Lopez, Madonna, Leonardo DiCaprio, and Kris Jenner among those eagerly expressing their concern on social media.

Politicians have jumped on the bandwagon too:

Our house is burning. Literally. The Amazon rain forest – the lungs which produces 20% of our planet’s oxygen – is on fire. It is an international crisis. Members of the G7 Summit, let’s discuss this emergency first order in two days! #ActForTheAmazon pic.twitter.com/dogOJj9big — Emmanuel Macron (@EmmanuelMacron) August 22, 2019

But almost everything you have read or heard about the Amazon fires in the mainstream media is #FakeNews.

Like so many of the environmental scare stories which grip the world’s media periodically, it is a panic which has been deliberately and cynically stoked by left-leaning eco-activist groups for a number of purposes:

To generate public hysteria in order to precipitate expensive and unnecessary government action which no sober cost benefit analysis could ever justify To raise ‘awareness’ — and, by extension, money — for the green cause To discredit conservatives, especially those who are properly sceptical of the green agenda, such as President Trump and his Brazilian counterpart Jair Bolsonaro To reinforce in the popular imagination the notion that economic growth and expressions of national sovereignty — in this case the interests of Brazilian farmers — are intrinsically bad for the environment To promulgate the common received idea that the Amazon is the ‘lungs of the planet’ and therefore sacrosanct and inviolable in much the same manner as polar bears, glaciers, Pacific islands, the Great Barrier Reef, etc. To lend false credibility to the global left’s claim that the planet is experiencing a #ClimateEmergency To invoke the spectre of the Green New Deal and, by extension, to rain on the parade of Trump 2020 To exploit the mainstream media’s insatiable demand for environmental scare stories, especially in the August “silly season” when there’s a shortage of real news

Here is the truth about the Amazon fires:

The fires are mainly on agricultural land – not virgin rain forest…

Turns out the Amazon Rain Forest fires aren’t exactly as advertised. Read for yourself: fires are mainly in agricultural areas as farmers prepare their land for planting. The land was cleared in the past. https://t.co/j8MXX8XWIH pic.twitter.com/hxhuxDZbeP — Ryan Maue (@RyanMaue) August 24, 2019

amazing: an informative article and very informative map by NYT on Amazon fires. Map shows that fires in previously cleared land. Nothing new. Furore is yet another fraud by enviro activists. https://t.co/xlMXiMZ9BM pic.twitter.com/e6p8GHW3BU — Stephen McIntyre (@ClimateAudit) August 24, 2019

There is nothing abnormal about this fire season

To everyone concerned about the future of the Amazon: sensationalizing the current fire season in the Amazon will not help keep it from burning.

Monthly Amazon fire count data from NASA in recent years: thick red line is 2019 thru present. https://t.co/86C0ZnhbGg pic.twitter.com/LFafdEJTiB — Dr Dan Nepstad (@dnepstad1) August 23, 2019

So, it appears: * Fire close to average from 2003-2018. (Period of MODIS operation.)

* Fire highest since 2012. Graphs and discussion in that article I linked leave out fires from 2003-2011. Presumably, there were big fires sometimes between 2003-2011. — lucia liljegren (@lucialiljegren) August 24, 2019

Even NASA admits this…

Deforestation is getting better, not worse

Deforestation has decreased markedly compared to the 1990-2005. Slash and burn land clearing is still an ongoing problem ~2,500 sq miles per year mainly for agriculture. pic.twitter.com/GFSvewBY0X — Ryan Maue (@RyanMaue) August 24, 2019

The Amazon rainforest does NOT produce 20 per cent of the world’s oxygen (h/t Dennis Ambler)

From a 2014 New York Times article by Nadine Unger, Assistant Professor of Atmospheric Chemistry at Yale:

Moreover, it is a myth that photosynthesis controls the amount of oxygen in the atmosphere. Even if all photosynthesis on the planet were shut down, the atmosphere’s oxygen content would change by less than 1 percent. The Amazon rain forest is often perceived as the lungs of the planet.



In fact, almost all the oxygen the Amazon produces during the day remains there and is reabsorbed by the forest at night. In other words, the Amazon rain forest is a closed system that uses all its own oxygen and carbon dioxide.

It wasn’t always rainforest… (h/t Dennis Ambler)

From a 2008 article ‘Brazil: Ancient Amazon Actually Highly Urbanised’

Using satellite imagery, scientists have discovered the remains of once densely populated towns in west Brazil, an area that was thought to be virgin forest. The report in Friday’s edition of the journal Science describes clusters of towns and smaller villages that were connected by complex road networks and were arranged around large central plazas. Researches also discovered signs of farming, wetland management and fish farms in the ancient settlements that are now almost completely covered by rainforest. As Professor Philip Stott, Emeritus Professor BioGeography at the School of Oriental and African Studies, University of London, wrote in 2003: At the end of the last ice age – some 12,000 to 18,000 years ago – the tropics were covered by seasonal savannah grassland, cooler and much drier than now. There were no rain forests in the Malay Peninsula and much of Amazonia, and, despite the increasing human development of forest space, there are still more rain forests persisting than existed then. Whatever the world’s greenies say, there is no adamantine rule that Brazil — or its neighbours — must stay rain forested in perpetuity.",1
"False Alarm: Amazon Burning Is Mostly Farms, Not Forests

Problematic deforestation continues, but the “lungs of the earth” are still breathing.

“A picture is worth a thousand words” is one of the dumbest aphorisms ever coined. Speaking as a former television producer, I’d say a picture takes a thousand words to explain. Take this much-circulated NASA satellite photo showing vast smoke plumes over the Amazon region:

Combined with a report from the Brazilian National Institute for Space Research that says the agency had detected 39,194 fires in the region, a 77 percent jump up from the same period in 2018, that picture has launched alarmed headlines around the world.

“Amazon rainforest is burning at an unprecedented rate,” declares CNN. The Daily Beast gives us “Record Number of Wildfires Burning in Amazon Rainforest.” Here’s NBC News: “Amazon wildfires could be ‘game over’ for climate change fight.”

Interestingly, when NASA released the satellite image on August 21, it noted that “it is not unusual to see fires in Brazil at this time of year due to high temperatures and low humidity. Time will tell if this year is a record breaking or just within normal limits.”

So why are there so many fires? “Natural fires in the Amazon are rare, and the majority of these fires were set by farmers preparing Amazon-adjacent farmland for next year’s crops and pasture,” soberly explains The New York Times. “Much of the land that is burning was not old-growth rain forest, but land that had already been cleared of trees and set for agricultural use.”

It is routine for farmers and ranchers in tropical areas burn their fields to control pests and weeds and to encourage new growth in pastures.

What about deforestation trends? Since the right-wing nationalist Jair Bolsonaro became Brazil’s president, rainforest deforestation rates have increased a bit, but they are still way below their earlier highs:

NYT

Various researchers have noted a U-shaped relation between environmental degradation and economic growth. As development takes off, levels of pollution and land degradation rise, but they begin to improve once certain thresholds of per capita incomes are attained. A 2012 study found, after parsing data from 52 developing countries between 1972 and 2003, that deforestation increases until average income levels reach about $3,100 per capita. As it happens, Brazilian per capita incomes reached $3,600 per capita in 2004,which is when deforestation rates began trending decisively downward.

While problematic deforestation is still taking place in the Amazon region, a 2018 study in Nature reported that the global tree canopy cover had increased by 865,000 square miles from 1982 to 2016. As Brazilians become wealthier, the deforestation trend in the Amazon will likely turn around toward afforestation, as it already has done many other countries.",1
"Things are bad for him - the fires are affecting air quality in states that are his political base, and they're concentrated not in the actual rainforest, but in areas of developed farmland , something Bolsonaro's encouraged to bring some kind of prosperity to Brazil's flyover.

The left is doing its level best to blame Brazil's bush fires on Brazil's conservative, Trump-like president, Jair Bolsonaro, and get him thrown out of office.

It's drawn tremendous negative press on him, and set European Union's eurochickens clucking, vowing at the G-7 to cut off trade with Brazil to pin those fires on Bolsonaro instead of the weather. Brazil doesn't deserve that, but these people are shameless.

Democrats, back in the states, are doing it, too. Here's one who wants to suspend all funding to Brazil until the fires (which Brazil is fighting) are under control.

Kamala Harris is onboard, as well, tweeting this anti-Bolsonaro screed:

As the Amazon burns, Brazil’s Trump-like President who let loggers and miners destroy the land isn’t acting. Trump must not seek a trade deal with Brazil until Bolsonaro reverses his catastrophic policies and addresses the fires. We need American leadership to save our planet. — Kamala Harris (@KamalaHarris) August 24, 2019

Never mind that the fires are within the range of fires that normally occur in dry areas during droughts. Brazil's fires, while they need attention, are in fact little different from the wildfires seen in Harris's own California, or for that matter, Spain or Australia. They're a function of the place's natural climate. Yet the euro-left has dancing visions about Brazil being the rainforest lungs of the world under great global catastrophe unless they can turn Brazil into a nature reserve to their liking, and of course to bring Bolsonaro to heel.

Look at this nonsense reported to a largely European readership from The Guardian:

In Rio de Janeiro, a couple of thousand people crowded the steps of the town hall. Many said the fires were a result of Bolsonaro’s plans to develop the Amazon forest and permit mining and commercial agriculture on protected indigenous reserves. The fires happen each dry Amazon winter but soared this year as farmers and loggers, emboldened by Bolsonaro’s anti-environment rhetoric, torched felled trees and cleared land for pasture. “We need to show how much we disagree with his policy,” said Mariane Rocha, a trainee teacher. Others were angry Bolsonaro blamed NGOs for the fires without providing evidence. “His whole political game is based on false accusations and mistakes,” said Beatriz Ferreira.

Well, guess what? The bid to blame Bolsonaro or his conservative policies on the fires in the Amazon falls apart now that news comes out that socialist Bolivia has exactly the same fire problem, and no, they aren't promoting development of land the way Bolsonaro is. According to ScienceAlert in a piece beginning with the following headline and lede:

It's Not Just Brazil's Amazon - Bolivia's Vital Forests Are Burning Out of Control, Too Up to 800,000 hectares of the unique Chiquitano forest were burned to the ground in Bolivia between August 18 and August 23. That's more forest than is usually destroyed across the country in two years.

Here's a Bolivian news account tweet:

#ANF Vea la dimensión de los incendios en #Roboré, Santa Cruz. Un sobrevuelo en la zona permitió verificar que el fuego arrasa extensiones de superficie de área boscosa. pic.twitter.com/d2BCI66CwN — Agencia Fides (ANF) (@noticiasfides) August 23, 2019

If anything, the dynamic there is far more man-made than anything going on in Brazil. Socialist President Evo Morales has openly encouraged what's known, at least in Venezuela, as ""conuco"" agriculture, telling subsistance farmers it's fine to set of fires to gather charcoal to sell for fuel or clear the land of brush for planting, and now he's refusing international firefighting help. When I visited Venezuela in 2005, I saw a lot of this going on over the jungle-edged savannahs and llanos and it was destructive. Apparently it goes on in Bolivia, too. The timing for that was not good now that the region is experiencing a drought.

Here's another claim that looks worthy of investigation as a result of that:

The left says that Bolsonaro's develop-the-rainforest policies are what's causing the fires, but this is highly questionable, given that in California, exactly the opposite is what triggers its huge and consuming wildfires - overforestation and greenie regulations. What's going on is bigger than any of this -- the issue is the weather and the correct management of conditions. Overforesting, as goes on in California, is as bad as conuco farming in Bolivia. In Brazil, there may be need for some policy adjustments, too, but it's no cause for panic or sanctions.

That's exactly what Europe and the U.S. Democrats are doing though, solely targeting Brazil which is in a difficult situation that requires support, not condemnation. Why is this happening> Well, because they hate Bolsonaro who to them is an extension of Trump. It's also because they still romantice the rainforest.

Now Bolivia is robbing them of their rimshot argument. No more Sting and the rainforest man for their ""narrative"" now. What appears to be a far more desperate and mismanaged situation is going on Bolivia, and we don't see any eurochicken clucking about the ""lungs of the world"" or sanctioning the socialist hellhole. The European Union and much of the G-7 are focused exclusively on Brazil and putting the screws to Bolsonaro blaming him for a broader temporary weather phenomenon. It's starting to look political and it would be a welcome thing if President Trump sticks up for the man among the clucker. Bolivia makes their hypocrisy show.

Image credit: Twitter screen shot",1
"Bolivia’s Wildfires Ignored By The BBC

By Paul Homewood

h/t Mr GrimNasty

I doubt whether you’ll see this on the BBC:

Up to 800,000 hectares of the unique Chiquitano forest were burned to the ground in Bolivia between August 18 and August 23. That’s more forest than is usually destroyed across the country in two years.

Experts say that it will take at least two centuries to repair the ecological damage done by the fires, while at least 500 species are said to be at risk from the flames.

The Chiquitano dry forest in Bolivia was the largest healthy tropical dry forest in the world. It’s now unclear whether it will retain that status. The forest is home to Indigenous peoples as well as iconic wildlife such as jaguars, giant armadillos, and tapirs. Some species in the Chiquitano are found nowhere else on Earth.

Distressing photographs and videos from the area show many animals have burned to death in the recent fires.

While the media has focused on Brazil, Bolivians are asking the world to notice their unfolding tragedy – and to send help in combating the flames.

It’s thought that the fires were started deliberately to clear the land for farming, but quickly got out of control. The perpetrators aren’t known, but Bolivian President Evo Morales has justified people starting fires, saying: ""If small families don’t set fires, what are they going to live on?""

The disaster comes just a month after Morales announced a new ""supreme decree"" aimed at increasing beef production for export

https://www.sciencealert.com/it-s-not-just-brazil-s-amazon-bolivia-s-vital-forests-are-on-fire-too

Of course, Evo Morales is a socialist, unlike Brazil’s Bolsonaro. But I am sure that had nothing to do with the BBC’s lack of interest in this story!",1
"The Amazon has made headlines this month as fires rip across the region. While this is the dry season for the area, during which fires are common, fires have nonetheless reached unprecedented highs this season — up 80 percent compared to last year. As the Amazon burns, the world has lit up with despair and outrage, with hashtags such as #PrayForTheAmazon going viral.

As the fires and emotional uproar continue, one naturally wonders ""who is to blame?"" Of course, the obvious cause is ""human ignition,"" as these fires are mostly due to farmers and ranchers using flames to clear forests and shrublands (a common practice in tropical regions). However, the underlying reason for farming-related fires is also important to pursue.

Some news reports point to climate change, as hotter and drier temperatures have contributed to the increased flammability of landscapes not only in Brazil, but all over the world. Others point to Brazil's new far-right President Jair Bolsonaro, who champions the exploitation of the Amazon for economic gain and who’s government has scaled back efforts to fight illegal logging, ranching and mining — thus emboldening more farmers, ranchers, and land-grabbers to clear forestlands.

ADVERTISEMENT

While these are important contributing factors, the evident international concern for the Amazon that has surfaced this month is not without irony. As we look to blame ranchers, politicians, and climate for these fires, we overlook a glaring paradox. That is, underlying the long-term destruction of the Amazon rain forest for decades has been global demand for meat products.

According to the U.S. Department of Agriculture, Brazil remains the world's number one beef exporter, accounting for nearly 20 percent of global exports, and still growing. As of 2018, Brazilian beef exports reached a record 1.6 million tonnes. Some reports suggest as much as 80 percent of Amazon forest destruction is related to cattle ranching.

Thus, as ranchers capitalize on drier-than-average weather this month to burn and clear forests, we must recognize the connection between fires in the Amazon and consumer demand. According to CNN, Finland has taken notice of this as the nation’s finance minister on Friday called for the European Union to ""urgently review the possibility of banning Brazilian beef imports"" in light of the Amazon fires.

Although the majority of Brazilian beef exports go to China and Hong Kong, the Unites States, European Union, and other nations nonetheless have roles to play, as we all fit into the picture of global demand.

The destruction of the Amazon means more than just the loss of beautiful forests. It’s also a blow to biodiversity. At a time when extinction rates are already 1,000 times higher than natural background rates, we should be doing everything we can to preserve the biodiversity that remains on our planet, rather than expediting its disappearance.

ADVERTISEMENT

What’s more, the Amazon rainforest plays a crucial role in oxygen production, carbon sequestration, and the saga surrounding climate change. Often called the lungs of the earth, the Amazon absorbs much of the carbon dioxide we emit to the atmosphere through human activity. When the forest burns, we not only remove this important carbon sink, but we also directly release carbon back to the atmosphere as fires convert solid biomass to carbon dioxide, a potent greenhouse gas.

Besides the impact that burning the Amazon has on greenhouse gas emissions, the livestock industry itself is notorious for its massive contribution to climate change and the buildup of greenhouse gases. Beef production is particularly problematic since cows produce a potent greenhouse gas called methane, which is even 30 times more heat-trapping than carbon dioxide.

Additionally, cattle require extensive food supplies, which increases the destruction of native habitats for farming while in the process placing increased demand on fossils fuels used to produce fertilizers, pesticides, and energy. All told, beef accounts for about 40 percent of livestock-related greenhouse gas emissions, and livestock accounts for 15 percent of total global emissions.

Once cleared, forests are not easily restored to their original condition, even with dedicated restoration efforts. This in part because soils deteriorate with the loss of plant cover, as the sun’s rays bake the ground and as rains wash away important topsoil.

Coming full circle, it is imperative to realize that we all have a role to play in the preservation of the Amazon. If images of this month’s forest fires have stirred public emotion, then it’s incumbent upon us to reflect on our personal behavior and understand how consumer choice at the grocery store fits into the story of either the preservation or ultimate destruction of the Amazon rainforest. It is often said that we cast a vote each time we use our dollar to make a purchase. This couldn’t ring truer than in the present context.

As the disappearing Amazon causes us to reflect on our personal consumer choices, we need not fall into the black and white tradition of thinking that one must be vegan or vegetarian to make a difference. Ecological impacts are not so dichotomous. A heavy meat eater who decides to reduce his or her meat consumption will make a difference, just as a light meat eater who decides to eliminate meat completely will do the same. These are all worthwhile pursuits as we realize our place in the important story of protecting the Amazon.

Shahir Masri, Sc.D., is the author of ""Beyond Debate: Answers to 50 Misconceptions on Climate Change."" He is an air pollution scientist at the University of California at Irvine, and also teaches at the Schmid College of Science and Technology at Chapman University. Follow him on Twitter at @ShahirMasri.",1
